/*******************************************************************************
Copyright (c) 2022-2024 Rapid Silicon
This source code contains proprietary information belonging to Rapid Silicon
(the "licensor") released under license and non-disclosure agreement to the
recipient (the "licensee").

The information shared and protected by the license and non-disclosure agreement
includes but is not limited to the following:
* operational algorithms of the product
* logos, graphics, source code, and visual presentation of the product
* confidential operational information of the licensor

The recipient of this source code is NOT permitted to publicly disclose,
re-use, archive beyond the period of the license agreement, transfer to a
sub-licensee, or re-implement any portion of the content covered by the license
and non-disclosure agreement without the prior written consent of the licensor.
*********************************************************************************/

Version  : 2024.03
Build    : 1.0.17
Hash     : 7566e6a
Date     : Mar 20 2024
Type     : Engineering
Log Time   : Wed Mar 20 09:10:08 2024 GMT
VPR FPGA Placement and Routing.
Version: 
Revision: 
Compiled: 
Compiler: GNU 11.2.1 on Linux-3.10.0-1160.90.1.el7.x86_64 x86_64
Build Info: Release VTR_ASSERT_LEVEL=2

University of Toronto
verilogtorouting.org
vtr-users@googlegroups.com
This is free open source code under MIT license.

VPR was run with the following command-line:
/nfs_eda_sw/softwares/Raptor/instl_dir/03_20_2024_09_15_01/bin/vpr /nfs_eda_sw/softwares/Raptor/instl_dir/03_20_2024_09_15_01/share/raptor/etc/devices/gemini_compact_10x8/gemini_vpr.xml /nfs_scratch/scratch/CompilerValidation/zaheer_ahmad/FullAdder32/FullAdder32/run_1/synth_1_1/synthesis/fabric_FullAdder32_post_synth.eblif --sdc_file /nfs_scratch/scratch/CompilerValidation/zaheer_ahmad/FullAdder32/FullAdder32/run_1/synth_1_1/impl_1_1_1/packing/fabric_FullAdder32_openfpga.sdc --route_chan_width 160 --suppress_warnings check_rr_node_warnings.log,check_rr_node --clock_modeling ideal --absorb_buffer_luts off --skip_sync_clustering_and_routing_results off --constant_net_method route --post_place_timing_report FullAdder32_post_place_timing.rpt --device castor10x8_heterogeneous --allow_unrelated_clustering on --allow_dangling_combinational_nodes on --place_delta_delay_matrix_calculation_method dijkstra --gen_post_synthesis_netlist on --post_synth_netlist_unconn_inputs gnd --inner_loop_recompute_divider 1 --max_router_iterations 1500 --timing_report_detail detailed --timing_report_npaths 100 --top FullAdder32 --net_file /nfs_scratch/scratch/CompilerValidation/zaheer_ahmad/FullAdder32/FullAdder32/run_1/synth_1_1/impl_1_1_1/packing/fabric_FullAdder32_post_synth.net --place_file /nfs_scratch/scratch/CompilerValidation/zaheer_ahmad/FullAdder32/FullAdder32/run_1/synth_1_1/impl_1_1_1/placement/fabric_FullAdder32_post_synth.place --route_file /nfs_scratch/scratch/CompilerValidation/zaheer_ahmad/FullAdder32/FullAdder32/run_1/synth_1_1/impl_1_1_1/routing/fabric_FullAdder32_post_synth.route --pack

Using up to 1 parallel worker(s)

Architecture file: /nfs_eda_sw/softwares/Raptor/instl_dir/03_20_2024_09_15_01/share/raptor/etc/devices/gemini_compact_10x8/gemini_vpr.xml
Circuit name: fabric_FullAdder32_post_synth

# Loading Architecture Description
Warning 1: Model 'io' input port 'outpad' has no timing specification (no clock specified to create a sequential input port, not combinationally connected to any outputs, not a clock input)
Warning 2: Model 'io' output port 'inpad' has no timing specification (no clock specified to create a sequential output port, not combinationally connected to any inputs, not a clock output)
Warning 3: Model 'dsp_phy' input port 'sc_in' has no timing specification (no clock specified to create a sequential input port, not combinationally connected to any outputs, not a clock input)
Warning 4: Model 'dsp_phy' input port 'lreset' has no timing specification (no clock specified to create a sequential input port, not combinationally connected to any outputs, not a clock input)
Warning 5: Model 'dsp_phy' output port 'sc_out' has no timing specification (no clock specified to create a sequential output port, not combinationally connected to any inputs, not a clock output)
Warning 6: Model 'RS_DSP_MULT' input port 'feedback' has no timing specification (no clock specified to create a sequential input port, not combinationally connected to any outputs, not a clock input)
Warning 7: Model 'RS_DSP_MULT' input port 'unsigned_b' has no timing specification (no clock specified to create a sequential input port, not combinationally connected to any outputs, not a clock input)
Warning 8: Model 'RS_DSP_MULT' input port 'unsigned_a' has no timing specification (no clock specified to create a sequential input port, not combinationally connected to any outputs, not a clock input)
Warning 9: Model 'RS_DSP_MULT_REGIN' input port 'lreset' has no timing specification (no clock specified to create a sequential input port, not combinationally connected to any outputs, not a clock input)
Warning 10: Model 'RS_DSP_MULT_REGIN' input port 'unsigned_b' has no timing specification (no clock specified to create a sequential input port, not combinationally connected to any outputs, not a clock input)
Warning 11: Model 'RS_DSP_MULT_REGIN' input port 'unsigned_a' has no timing specification (no clock specified to create a sequential input port, not combinationally connected to any outputs, not a clock input)
Warning 12: Model 'RS_DSP_MULT_REGOUT' input port 'lreset' has no timing specification (no clock specified to create a sequential input port, not combinationally connected to any outputs, not a clock input)
Warning 13: Model 'RS_DSP_MULT_REGOUT' input port 'unsigned_b' has no timing specification (no clock specified to create a sequential input port, not combinationally connected to any outputs, not a clock input)
Warning 14: Model 'RS_DSP_MULT_REGOUT' input port 'unsigned_a' has no timing specification (no clock specified to create a sequential input port, not combinationally connected to any outputs, not a clock input)
Warning 15: Model 'RS_DSP_MULT_REGIN_REGOUT' input port 'lreset' has no timing specification (no clock specified to create a sequential input port, not combinationally connected to any outputs, not a clock input)
Warning 16: Model 'RS_DSP_MULT_REGIN_REGOUT' input port 'unsigned_b' has no timing specification (no clock specified to create a sequential input port, not combinationally connected to any outputs, not a clock input)
Warning 17: Model 'RS_DSP_MULT_REGIN_REGOUT' input port 'unsigned_a' has no timing specification (no clock specified to create a sequential input port, not combinationally connected to any outputs, not a clock input)
Warning 18: Model 'RS_DSP_MULTADD' input port 'round' has no timing specification (no clock specified to create a sequential input port, not combinationally connected to any outputs, not a clock input)
Warning 19: Model 'RS_DSP_MULTADD' input port 'shift_right' has no timing specification (no clock specified to create a sequential input port, not combinationally connected to any outputs, not a clock input)
Warning 20: Model 'RS_DSP_MULTADD' input port 'saturate_enable' has no timing specification (no clock specified to create a sequential input port, not combinationally connected to any outputs, not a clock input)
Warning 21: Model 'RS_DSP_MULTADD' input port 'lreset' has no timing specification (no clock specified to create a sequential input port, not combinationally connected to any outputs, not a clock input)
Warning 22: Model 'RS_DSP_MULTADD' input port 'unsigned_b' has no timing specification (no clock specified to create a sequential input port, not combinationally connected to any outputs, not a clock input)
Warning 23: Model 'RS_DSP_MULTADD' input port 'unsigned_a' has no timing specification (no clock specified to create a sequential input port, not combinationally connected to any outputs, not a clock input)
Warning 24: Model 'RS_DSP_MULTADD_REGIN' input port 'round' has no timing specification (no clock specified to create a sequential input port, not combinationally connected to any outputs, not a clock input)
Warning 25: Model 'RS_DSP_MULTADD_REGIN' input port 'shift_right' has no timing specification (no clock specified to create a sequential input port, not combinationally connected to any outputs, not a clock input)
Warning 26: Model 'RS_DSP_MULTADD_REGIN' input port 'saturate_enable' has no timing specification (no clock specified to create a sequential input port, not combinationally connected to any outputs, not a clock input)
Warning 27: Model 'RS_DSP_MULTADD_REGIN' input port 'lreset' has no timing specification (no clock specified to create a sequential input port, not combinationally connected to any outputs, not a clock input)
Warning 28: Model 'RS_DSP_MULTADD_REGIN' input port 'unsigned_b' has no timing specification (no clock specified to create a sequential input port, not combinationally connected to any outputs, not a clock input)
Warning 29: Model 'RS_DSP_MULTADD_REGIN' input port 'unsigned_a' has no timing specification (no clock specified to create a sequential input port, not combinationally connected to any outputs, not a clock input)
Warning 30: Model 'RS_DSP_MULTADD_REGOUT' input port 'round' has no timing specification (no clock specified to create a sequential input port, not combinationally connected to any outputs, not a clock input)
Warning 31: Model 'RS_DSP_MULTADD_REGOUT' input port 'shift_right' has no timing specification (no clock specified to create a sequential input port, not combinationally connected to any outputs, not a clock input)
Warning 32: Model 'RS_DSP_MULTADD_REGOUT' input port 'saturate_enable' has no timing specification (no clock specified to create a sequential input port, not combinationally connected to any outputs, not a clock input)
Warning 33: Model 'RS_DSP_MULTADD_REGOUT' input port 'lreset' has no timing specification (no clock specified to create a sequential input port, not combinationally connected to any outputs, not a clock input)
Warning 34: Model 'RS_DSP_MULTADD_REGOUT' input port 'unsigned_b' has no timing specification (no clock specified to create a sequential input port, not combinationally connected to any outputs, not a clock input)
Warning 35: Model 'RS_DSP_MULTADD_REGOUT' input port 'unsigned_a' has no timing specification (no clock specified to create a sequential input port, not combinationally connected to any outputs, not a clock input)
Warning 36: Model 'RS_DSP_MULTADD_REGIN_REGOUT' input port 'round' has no timing specification (no clock specified to create a sequential input port, not combinationally connected to any outputs, not a clock input)
Warning 37: Model 'RS_DSP_MULTADD_REGIN_REGOUT' input port 'shift_right' has no timing specification (no clock specified to create a sequential input port, not combinationally connected to any outputs, not a clock input)
Warning 38: Model 'RS_DSP_MULTADD_REGIN_REGOUT' input port 'saturate_enable' has no timing specification (no clock specified to create a sequential input port, not combinationally connected to any outputs, not a clock input)
Warning 39: Model 'RS_DSP_MULTADD_REGIN_REGOUT' input port 'lreset' has no timing specification (no clock specified to create a sequential input port, not combinationally connected to any outputs, not a clock input)
Warning 40: Model 'RS_DSP_MULTADD_REGIN_REGOUT' input port 'unsigned_b' has no timing specification (no clock specified to create a sequential input port, not combinationally connected to any outputs, not a clock input)
Warning 41: Model 'RS_DSP_MULTADD_REGIN_REGOUT' input port 'unsigned_a' has no timing specification (no clock specified to create a sequential input port, not combinationally connected to any outputs, not a clock input)
Warning 42: Model 'RS_DSP_MULTACC' input port 'round' has no timing specification (no clock specified to create a sequential input port, not combinationally connected to any outputs, not a clock input)
Warning 43: Model 'RS_DSP_MULTACC' input port 'shift_right' has no timing specification (no clock specified to create a sequential input port, not combinationally connected to any outputs, not a clock input)
Warning 44: Model 'RS_DSP_MULTACC' input port 'saturate_enable' has no timing specification (no clock specified to create a sequential input port, not combinationally connected to any outputs, not a clock input)
Warning 45: Model 'RS_DSP_MULTACC' input port 'lreset' has no timing specification (no clock specified to create a sequential input port, not combinationally connected to any outputs, not a clock input)
Warning 46: Model 'RS_DSP_MULTACC' input port 'unsigned_b' has no timing specification (no clock specified to create a sequential input port, not combinationally connected to any outputs, not a clock input)
Warning 47: Model 'RS_DSP_MULTACC' input port 'unsigned_a' has no timing specification (no clock specified to create a sequential input port, not combinationally connected to any outputs, not a clock input)
Warning 48: Model 'RS_DSP_MULTACC_REGIN' input port 'round' has no timing specification (no clock specified to create a sequential input port, not combinationally connected to any outputs, not a clock input)
Warning 49: Model 'RS_DSP_MULTACC_REGIN' input port 'shift_right' has no timing specification (no clock specified to create a sequential input port, not combinationally connected to any outputs, not a clock input)
Warning 50: Model 'RS_DSP_MULTACC_REGIN' input port 'saturate_enable' has no timing specification (no clock specified to create a sequential input port, not combinationally connected to any outputs, not a clock input)
Warning 51: Model 'RS_DSP_MULTACC_REGIN' input port 'lreset' has no timing specification (no clock specified to create a sequential input port, not combinationally connected to any outputs, not a clock input)
Warning 52: Model 'RS_DSP_MULTACC_REGIN' input port 'unsigned_b' has no timing specification (no clock specified to create a sequential input port, not combinationally connected to any outputs, not a clock input)
Warning 53: Model 'RS_DSP_MULTACC_REGIN' input port 'unsigned_a' has no timing specification (no clock specified to create a sequential input port, not combinationally connected to any outputs, not a clock input)
Warning 54: Model 'RS_DSP_MULTACC_REGOUT' input port 'round' has no timing specification (no clock specified to create a sequential input port, not combinationally connected to any outputs, not a clock input)
Warning 55: Model 'RS_DSP_MULTACC_REGOUT' input port 'shift_right' has no timing specification (no clock specified to create a sequential input port, not combinationally connected to any outputs, not a clock input)
Warning 56: Model 'RS_DSP_MULTACC_REGOUT' input port 'saturate_enable' has no timing specification (no clock specified to create a sequential input port, not combinationally connected to any outputs, not a clock input)
Warning 57: Model 'RS_DSP_MULTACC_REGOUT' input port 'lreset' has no timing specification (no clock specified to create a sequential input port, not combinationally connected to any outputs, not a clock input)
Warning 58: Model 'RS_DSP_MULTACC_REGOUT' input port 'unsigned_b' has no timing specification (no clock specified to create a sequential input port, not combinationally connected to any outputs, not a clock input)
Warning 59: Model 'RS_DSP_MULTACC_REGOUT' input port 'unsigned_a' has no timing specification (no clock specified to create a sequential input port, not combinationally connected to any outputs, not a clock input)
Warning 60: Model 'RS_DSP_MULTACC_REGIN_REGOUT' input port 'round' has no timing specification (no clock specified to create a sequential input port, not combinationally connected to any outputs, not a clock input)
Warning 61: Model 'RS_DSP_MULTACC_REGIN_REGOUT' input port 'shift_right' has no timing specification (no clock specified to create a sequential input port, not combinationally connected to any outputs, not a clock input)
Warning 62: Model 'RS_DSP_MULTACC_REGIN_REGOUT' input port 'saturate_enable' has no timing specification (no clock specified to create a sequential input port, not combinationally connected to any outputs, not a clock input)
Warning 63: Model 'RS_DSP_MULTACC_REGIN_REGOUT' input port 'lreset' has no timing specification (no clock specified to create a sequential input port, not combinationally connected to any outputs, not a clock input)
Warning 64: Model 'RS_DSP_MULTACC_REGIN_REGOUT' input port 'unsigned_b' has no timing specification (no clock specified to create a sequential input port, not combinationally connected to any outputs, not a clock input)
Warning 65: Model 'RS_DSP_MULTACC_REGIN_REGOUT' input port 'unsigned_a' has no timing specification (no clock specified to create a sequential input port, not combinationally connected to any outputs, not a clock input)
Warning 66: Model 'bram_phy' input port 'sc_in' has no timing specification (no clock specified to create a sequential input port, not combinationally connected to any outputs, not a clock input)
Warning 67: Model 'bram_phy' output port 'sc_out' has no timing specification (no clock specified to create a sequential output port, not combinationally connected to any inputs, not a clock output)
Warning 68: Model 'bram_phy' output port 'PL_DATA_o' has no timing specification (no clock specified to create a sequential output port, not combinationally connected to any inputs, not a clock output)
Warning 69: Model 'bram_phy' output port 'PL_ADDR_o' has no timing specification (no clock specified to create a sequential output port, not combinationally connected to any inputs, not a clock output)
Warning 70: Model 'bram_phy' output port 'PL_WEN_o' has no timing specification (no clock specified to create a sequential output port, not combinationally connected to any inputs, not a clock output)
Warning 71: Model 'bram_phy' output port 'PL_CLK_o' has no timing specification (no clock specified to create a sequential output port, not combinationally connected to any inputs, not a clock output)
Warning 72: Model 'bram_phy' output port 'PL_REN_o' has no timing specification (no clock specified to create a sequential output port, not combinationally connected to any inputs, not a clock output)
Warning 73: Model 'bram_phy' output port 'PL_ENA_o' has no timing specification (no clock specified to create a sequential output port, not combinationally connected to any inputs, not a clock output)
Warning 74: Model 'bram_phy' output port 'PL_INIT_o' has no timing specification (no clock specified to create a sequential output port, not combinationally connected to any inputs, not a clock output)
mode 'io[physical]' is defined by user to be disabled in packing
mode 'iopad[default]' is defined by user to be disabled in packing
mode 'fle[physical]' is defined by user to be disabled in packing
mode 'fabric[default]' is defined by user to be disabled in packing
mode 'ff_bypass[default]' is defined by user to be disabled in packing
mode 'dsp_lr[physical]' is defined by user to be disabled in packing
mode 'bram_lr[physical]' is defined by user to be disabled in packing
# Loading Architecture Description took 0.06 seconds (max_rss 16.7 MiB, delta_rss +0.0 MiB)

Timing analysis: ON
Circuit netlist file: /nfs_scratch/scratch/CompilerValidation/zaheer_ahmad/FullAdder32/FullAdder32/run_1/synth_1_1/impl_1_1_1/packing/fabric_FullAdder32_post_synth.net
Circuit placement file: /nfs_scratch/scratch/CompilerValidation/zaheer_ahmad/FullAdder32/FullAdder32/run_1/synth_1_1/impl_1_1_1/placement/fabric_FullAdder32_post_synth.place
Circuit routing file: /nfs_scratch/scratch/CompilerValidation/zaheer_ahmad/FullAdder32/FullAdder32/run_1/synth_1_1/impl_1_1_1/routing/fabric_FullAdder32_post_synth.route
Circuit SDC file: /nfs_scratch/scratch/CompilerValidation/zaheer_ahmad/FullAdder32/FullAdder32/run_1/synth_1_1/impl_1_1_1/packing/fabric_FullAdder32_openfpga.sdc
Vpr floorplanning constraints file: not specified

Packer: ENABLED
Placer: DISABLED
Router: DISABLED
Analysis: DISABLED

VPR was run with the following options:

NetlistOpts.abosrb_buffer_luts            : false
NetlistOpts.sweep_dangling_primary_ios    : true
NetlistOpts.sweep_dangling_nets           : true
NetlistOpts.sweep_dangling_blocks         : true
NetlistOpts.sweep_constant_primary_outputs: false
NetlistOpts.netlist_verbosity             : 1
NetlistOpts.const_gen_inference           : COMB_SEQ

PackerOpts.allow_unrelated_clustering: true
PackerOpts.alpha_clustering: 0.750000
PackerOpts.beta_clustering: 0.900000
PackerOpts.cluster_seed_type: BLEND2
PackerOpts.connection_driven: true
PackerOpts.global_clocks: true
PackerOpts.hill_climbing_flag: false
PackerOpts.inter_cluster_net_delay: 1.000000
PackerOpts.timing_driven: true
PackerOpts.target_external_pin_util: auto

# Building complex block graph
Warning 75: clb[0].sr_in[0] unconnected pin in architecture.
Warning 76: clb[0].sr_out[0] unconnected pin in architecture.
Warning 77: dsp[0].sr_in[0] unconnected pin in architecture.
Warning 78: dsp[0].sr_in[1] unconnected pin in architecture.
Warning 79: dsp[0].sr_in[2] unconnected pin in architecture.
Warning 80: dsp[0].sr_out[0] unconnected pin in architecture.
Warning 81: dsp[0].sr_out[1] unconnected pin in architecture.
Warning 82: dsp[0].sr_out[2] unconnected pin in architecture.
Warning 83: bram[0].sr_in[0] unconnected pin in architecture.
Warning 84: bram[0].sr_in[1] unconnected pin in architecture.
Warning 85: bram[0].sr_in[2] unconnected pin in architecture.
Warning 86: bram[0].sr_in[3] unconnected pin in architecture.
Warning 87: bram[0].sr_in[4] unconnected pin in architecture.
Warning 88: bram[0].sr_in[5] unconnected pin in architecture.
Warning 89: bram[0].plr_i[0] unconnected pin in architecture.
Warning 90: bram[0].plr_i[1] unconnected pin in architecture.
Warning 91: bram[0].plr_i[2] unconnected pin in architecture.
Warning 92: bram[0].plr_i[3] unconnected pin in architecture.
Warning 93: bram[0].plr_i[4] unconnected pin in architecture.
Warning 94: bram[0].plr_i[5] unconnected pin in architecture.
Warning 95: bram[0].plr_i[6] unconnected pin in architecture.
Warning 96: bram[0].plr_i[7] unconnected pin in architecture.
Warning 97: bram[0].plr_i[8] unconnected pin in architecture.
Warning 98: bram[0].plr_i[9] unconnected pin in architecture.
Warning 99: bram[0].plr_i[10] unconnected pin in architecture.
Warning 100: bram[0].plr_i[11] unconnected pin in architecture.
Warning 101: bram[0].plr_i[12] unconnected pin in architecture.
Warning 102: bram[0].plr_i[13] unconnected pin in architecture.
Warning 103: bram[0].plr_i[14] unconnected pin in architecture.
Warning 104: bram[0].plr_i[15] unconnected pin in architecture.
Warning 105: bram[0].plr_i[16] unconnected pin in architecture.
Warning 106: bram[0].plr_i[17] unconnected pin in architecture.
Warning 107: bram[0].plr_i[18] unconnected pin in architecture.
Warning 108: bram[0].plr_i[19] unconnected pin in architecture.
Warning 109: bram[0].plr_i[20] unconnected pin in architecture.
Warning 110: bram[0].plr_i[21] unconnected pin in architecture.
Warning 111: bram[0].plr_i[22] unconnected pin in architecture.
Warning 112: bram[0].plr_i[23] unconnected pin in architecture.
Warning 113: bram[0].plr_i[24] unconnected pin in architecture.
Warning 114: bram[0].plr_i[25] unconnected pin in architecture.
Warning 115: bram[0].plr_i[26] unconnected pin in architecture.
Warning 116: bram[0].plr_i[27] unconnected pin in architecture.
Warning 117: bram[0].plr_i[28] unconnected pin in architecture.
Warning 118: bram[0].plr_i[29] unconnected pin in architecture.
Warning 119: bram[0].plr_i[30] unconnected pin in architecture.
Warning 120: bram[0].plr_i[31] unconnected pin in architecture.
Warning 121: bram[0].plr_i[32] unconnected pin in architecture.
Warning 122: bram[0].plr_i[33] unconnected pin in architecture.
Warning 123: bram[0].plr_i[34] unconnected pin in architecture.
Warning 124: bram[0].plr_i[35] unconnected pin in architecture.
Warning 125: bram[0].sr_out[0] unconnected pin in architecture.
Warning 126: bram[0].sr_out[1] unconnected pin in architecture.
Warning 127: bram[0].sr_out[2] unconnected pin in architecture.
Warning 128: bram[0].sr_out[3] unconnected pin in architecture.
Warning 129: bram[0].sr_out[4] unconnected pin in architecture.
Warning 130: bram[0].sr_out[5] unconnected pin in architecture.
Warning 131: bram[0].plr_o[0] unconnected pin in architecture.
Warning 132: bram[0].plr_o[1] unconnected pin in architecture.
Warning 133: bram[0].plr_o[2] unconnected pin in architecture.
Warning 134: bram[0].plr_o[3] unconnected pin in architecture.
Warning 135: bram[0].plr_o[4] unconnected pin in architecture.
Warning 136: bram[0].plr_o[5] unconnected pin in architecture.
Warning 137: bram[0].plr_o[6] unconnected pin in architecture.
Warning 138: bram[0].plr_o[7] unconnected pin in architecture.
Warning 139: bram[0].plr_o[8] unconnected pin in architecture.
Warning 140: bram[0].plr_o[9] unconnected pin in architecture.
Warning 141: bram[0].plr_o[10] unconnected pin in architecture.
Warning 142: bram[0].plr_o[11] unconnected pin in architecture.
Warning 143: bram[0].plr_o[12] unconnected pin in architecture.
Warning 144: bram[0].plr_o[13] unconnected pin in architecture.
Warning 145: bram[0].plr_o[14] unconnected pin in architecture.
Warning 146: bram[0].plr_o[15] unconnected pin in architecture.
Warning 147: bram[0].plr_o[16] unconnected pin in architecture.
Warning 148: bram[0].plr_o[17] unconnected pin in architecture.
Warning 149: bram[0].plr_o[18] unconnected pin in architecture.
Warning 150: bram[0].plr_o[19] unconnected pin in architecture.
Warning 151: bram[0].plr_o[20] unconnected pin in architecture.
Warning 152: bram[0].plr_o[21] unconnected pin in architecture.
Warning 153: bram[0].plr_o[22] unconnected pin in architecture.
Warning 154: bram[0].plr_o[23] unconnected pin in architecture.
Warning 155: bram[0].plr_o[24] unconnected pin in architecture.
Warning 156: bram[0].plr_o[25] unconnected pin in architecture.
Warning 157: bram[0].plr_o[26] unconnected pin in architecture.
Warning 158: bram[0].plr_o[27] unconnected pin in architecture.
Warning 159: bram[0].plr_o[28] unconnected pin in architecture.
Warning 160: bram[0].plr_o[29] unconnected pin in architecture.
Warning 161: bram[0].plr_o[30] unconnected pin in architecture.
Warning 162: bram[0].plr_o[31] unconnected pin in architecture.
Warning 163: bram[0].plr_o[32] unconnected pin in architecture.
Warning 164: bram[0].plr_o[33] unconnected pin in architecture.
Warning 165: bram[0].plr_o[34] unconnected pin in architecture.
Warning 166: bram[0].plr_o[35] unconnected pin in architecture.
# Building complex block graph took 0.04 seconds (max_rss 18.2 MiB, delta_rss +1.5 MiB)
Circuit file: /nfs_scratch/scratch/CompilerValidation/zaheer_ahmad/FullAdder32/FullAdder32/run_1/synth_1_1/synthesis/fabric_FullAdder32_post_synth.eblif
# Load circuit
Found constant-zero generator '$false'
Found constant-one generator '$true'
Found constant-zero generator '$undef'
# Load circuit took 0.01 seconds (max_rss 19.0 MiB, delta_rss +0.8 MiB)
# Clean circuit
Inferred    0 additional primitive pins as constant generators since they have no combinationally connected inputs
Inferred    0 additional primitive pins as constant generators due to constant inputs
Inferred    0 additional primitive pins as constant generators since they have no combinationally connected inputs
Inferred    0 additional primitive pins as constant generators due to constant inputs
Inferred    0 additional primitive pins as constant generators since they have no combinationally connected inputs
Inferred    0 additional primitive pins as constant generators due to constant inputs
Swept input(s)      : 0
Swept output(s)     : 0 (0 dangling, 0 constant)
Swept net(s)        : 3
Swept block(s)      : 3
Constant Pins Marked: 0
# Clean circuit took 0.00 seconds (max_rss 19.0 MiB, delta_rss +0.0 MiB)
# Compress circuit
# Compress circuit took 0.00 seconds (max_rss 19.0 MiB, delta_rss +0.0 MiB)
# Verify circuit
# Verify circuit took 0.00 seconds (max_rss 19.0 MiB, delta_rss +0.0 MiB)
Circuit Statistics:
  Blocks: 168
    .input :      65
    .output:      33
    6-LUT  :      70
  Nets  : 135
    Avg Fanout:     2.8
    Max Fanout:    10.0
    Min Fanout:     1.0
  Netlist Clocks: 0
# Build Timing Graph
  Timing Graph Nodes: 514
  Timing Graph Edges: 725
  Timing Graph Levels: 10
# Build Timing Graph took 0.00 seconds (max_rss 19.2 MiB, delta_rss +0.3 MiB)
Netlist contains 0 clocks
# Load Timing Constraints
Warning 167: set_input_delay command matched but was not applied to primary output '$iopadmap$sum[0]'
Warning 168: set_input_delay command matched but was not applied to primary output '$iopadmap$sum[1]'
Warning 169: set_input_delay command matched but was not applied to primary output '$iopadmap$sum[2]'
Warning 170: set_input_delay command matched but was not applied to primary output '$iopadmap$sum[3]'
Warning 171: set_input_delay command matched but was not applied to primary output '$iopadmap$sum[4]'
Warning 172: set_input_delay command matched but was not applied to primary output '$iopadmap$sum[5]'
Warning 173: set_input_delay command matched but was not applied to primary output '$iopadmap$sum[6]'
Warning 174: set_input_delay command matched but was not applied to primary output '$iopadmap$sum[7]'
Warning 175: set_input_delay command matched but was not applied to primary output '$iopadmap$sum[8]'
Warning 176: set_input_delay command matched but was not applied to primary output '$iopadmap$sum[9]'
Warning 177: set_input_delay command matched but was not applied to primary output '$iopadmap$sum[10]'
Warning 178: set_input_delay command matched but was not applied to primary output '$iopadmap$sum[11]'
Warning 179: set_input_delay command matched but was not applied to primary output '$iopadmap$sum[12]'
Warning 180: set_input_delay command matched but was not applied to primary output '$iopadmap$sum[13]'
Warning 181: set_input_delay command matched but was not applied to primary output '$iopadmap$sum[14]'
Warning 182: set_input_delay command matched but was not applied to primary output '$iopadmap$sum[15]'
Warning 183: set_input_delay command matched but was not applied to primary output '$iopadmap$sum[16]'
Warning 184: set_input_delay command matched but was not applied to primary output '$iopadmap$sum[17]'
Warning 185: set_input_delay command matched but was not applied to primary output '$iopadmap$sum[18]'
Warning 186: set_input_delay command matched but was not applied to primary output '$iopadmap$sum[19]'
Warning 187: set_input_delay command matched but was not applied to primary output '$iopadmap$sum[20]'
Warning 188: set_input_delay command matched but was not applied to primary output '$iopadmap$sum[21]'
Warning 189: set_input_delay command matched but was not applied to primary output '$iopadmap$sum[22]'
Warning 190: set_input_delay command matched but was not applied to primary output '$iopadmap$sum[23]'
Warning 191: set_input_delay command matched but was not applied to primary output '$iopadmap$sum[24]'
Warning 192: set_input_delay command matched but was not applied to primary output '$iopadmap$sum[25]'
Warning 193: set_input_delay command matched but was not applied to primary output '$iopadmap$sum[26]'
Warning 194: set_input_delay command matched but was not applied to primary output '$iopadmap$sum[27]'
Warning 195: set_input_delay command matched but was not applied to primary output '$iopadmap$sum[28]'
Warning 196: set_input_delay command matched but was not applied to primary output '$iopadmap$sum[29]'
Warning 197: set_input_delay command matched but was not applied to primary output '$iopadmap$sum[30]'
Warning 198: set_input_delay command matched but was not applied to primary output '$iopadmap$sum[31]'
Warning 199: set_input_delay command matched but was not applied to primary output '$iopadmap$cout'
Warning 200: set_output_delay command matched but was not applied to primary input '$iopadmap$cin'
Warning 201: set_output_delay command matched but was not applied to primary input '$iopadmap$b[0]'
Warning 202: set_output_delay command matched but was not applied to primary input '$iopadmap$b[1]'
Warning 203: set_output_delay command matched but was not applied to primary input '$iopadmap$b[2]'
Warning 204: set_output_delay command matched but was not applied to primary input '$iopadmap$b[3]'
Warning 205: set_output_delay command matched but was not applied to primary input '$iopadmap$b[4]'
Warning 206: set_output_delay command matched but was not applied to primary input '$iopadmap$b[5]'
Warning 207: set_output_delay command matched but was not applied to primary input '$iopadmap$b[6]'
Warning 208: set_output_delay command matched but was not applied to primary input '$iopadmap$b[7]'
Warning 209: set_output_delay command matched but was not applied to primary input '$iopadmap$b[8]'
Warning 210: set_output_delay command matched but was not applied to primary input '$iopadmap$b[9]'
Warning 211: set_output_delay command matched but was not applied to primary input '$iopadmap$b[10]'
Warning 212: set_output_delay command matched but was not applied to primary input '$iopadmap$b[11]'
Warning 213: set_output_delay command matched but was not applied to primary input '$iopadmap$b[12]'
Warning 214: set_output_delay command matched but was not applied to primary input '$iopadmap$b[13]'
Warning 215: set_output_delay command matched but was not applied to primary input '$iopadmap$b[14]'
Warning 216: set_output_delay command matched but was not applied to primary input '$iopadmap$b[15]'
Warning 217: set_output_delay command matched but was not applied to primary input '$iopadmap$b[16]'
Warning 218: set_output_delay command matched but was not applied to primary input '$iopadmap$b[17]'
Warning 219: set_output_delay command matched but was not applied to primary input '$iopadmap$b[18]'
Warning 220: set_output_delay command matched but was not applied to primary input '$iopadmap$b[19]'
Warning 221: set_output_delay command matched but was not applied to primary input '$iopadmap$b[20]'
Warning 222: set_output_delay command matched but was not applied to primary input '$iopadmap$b[21]'
Warning 223: set_output_delay command matched but was not applied to primary input '$iopadmap$b[22]'
Warning 224: set_output_delay command matched but was not applied to primary input '$iopadmap$b[23]'
Warning 225: set_output_delay command matched but was not applied to primary input '$iopadmap$b[24]'
Warning 226: set_output_delay command matched but was not applied to primary input '$iopadmap$b[25]'
Warning 227: set_output_delay command matched but was not applied to primary input '$iopadmap$b[26]'
Warning 228: set_output_delay command matched but was not applied to primary input '$iopadmap$b[27]'
Warning 229: set_output_delay command matched but was not applied to primary input '$iopadmap$b[28]'
Warning 230: set_output_delay command matched but was not applied to primary input '$iopadmap$b[29]'
Warning 231: set_output_delay command matched but was not applied to primary input '$iopadmap$b[30]'
Warning 232: set_output_delay command matched but was not applied to primary input '$iopadmap$b[31]'
Warning 233: set_output_delay command matched but was not applied to primary input '$iopadmap$a[0]'
Warning 234: set_output_delay command matched but was not applied to primary input '$iopadmap$a[1]'
Warning 235: set_output_delay command matched but was not applied to primary input '$iopadmap$a[2]'
Warning 236: set_output_delay command matched but was not applied to primary input '$iopadmap$a[3]'
Warning 237: set_output_delay command matched but was not applied to primary input '$iopadmap$a[4]'
Warning 238: set_output_delay command matched but was not applied to primary input '$iopadmap$a[5]'
Warning 239: set_output_delay command matched but was not applied to primary input '$iopadmap$a[6]'
Warning 240: set_output_delay command matched but was not applied to primary input '$iopadmap$a[7]'
Warning 241: set_output_delay command matched but was not applied to primary input '$iopadmap$a[8]'
Warning 242: set_output_delay command matched but was not applied to primary input '$iopadmap$a[9]'
Warning 243: set_output_delay command matched but was not applied to primary input '$iopadmap$a[10]'
Warning 244: set_output_delay command matched but was not applied to primary input '$iopadmap$a[11]'
Warning 245: set_output_delay command matched but was not applied to primary input '$iopadmap$a[12]'
Warning 246: set_output_delay command matched but was not applied to primary input '$iopadmap$a[13]'
Warning 247: set_output_delay command matched but was not applied to primary input '$iopadmap$a[14]'
Warning 248: set_output_delay command matched but was not applied to primary input '$iopadmap$a[15]'
Warning 249: set_output_delay command matched but was not applied to primary input '$iopadmap$a[16]'
Warning 250: set_output_delay command matched but was not applied to primary input '$iopadmap$a[17]'
Warning 251: set_output_delay command matched but was not applied to primary input '$iopadmap$a[18]'
Warning 252: set_output_delay command matched but was not applied to primary input '$iopadmap$a[19]'
Warning 253: set_output_delay command matched but was not applied to primary input '$iopadmap$a[20]'
Warning 254: set_output_delay command matched but was not applied to primary input '$iopadmap$a[21]'
Warning 255: set_output_delay command matched but was not applied to primary input '$iopadmap$a[22]'
Warning 256: set_output_delay command matched but was not applied to primary input '$iopadmap$a[23]'
Warning 257: set_output_delay command matched but was not applied to primary input '$iopadmap$a[24]'
Warning 258: set_output_delay command matched but was not applied to primary input '$iopadmap$a[25]'
Warning 259: set_output_delay command matched but was not applied to primary input '$iopadmap$a[26]'
Warning 260: set_output_delay command matched but was not applied to primary input '$iopadmap$a[27]'
Warning 261: set_output_delay command matched but was not applied to primary input '$iopadmap$a[28]'
Warning 262: set_output_delay command matched but was not applied to primary input '$iopadmap$a[29]'
Warning 263: set_output_delay command matched but was not applied to primary input '$iopadmap$a[30]'
Warning 264: set_output_delay command matched but was not applied to primary input '$iopadmap$a[31]'

Applied 3 SDC commands from '/nfs_scratch/scratch/CompilerValidation/zaheer_ahmad/FullAdder32/FullAdder32/run_1/synth_1_1/impl_1_1_1/packing/fabric_FullAdder32_openfpga.sdc'
Timing constraints created 1 clocks
  Constrained Clock 'clk' (Virtual Clock)

# Load Timing Constraints took 0.00 seconds (max_rss 19.4 MiB, delta_rss +0.2 MiB)
# Packing
Begin packing '/nfs_scratch/scratch/CompilerValidation/zaheer_ahmad/FullAdder32/FullAdder32/run_1/synth_1_1/synthesis/fabric_FullAdder32_post_synth.eblif'.

After removing unused inputs...
	total blocks: 168, total nets: 135, total inputs: 65, total outputs: 33
Begin prepacking.

There is one chain in this architecture called "carrychain" with the following starting points:
	clb[0]/clb_lr[0]/fle[0]/adder[0]/adder_carry[0].cin[0]

0 attraction groups were created during prepacking.
Finish prepacking.
Using inter-cluster delay: 8.9048e-10
Packing with pin utilization targets: io_top:1,1 io_right:1,1 io_bottom:1,1 io_left:1,1 clb:0.8,1 dsp:1,1 bram:1,1
Packing with high fanout thresholds: io_top:128 io_right:128 io_bottom:128 io_left:128 clb:32 dsp:128 bram:128
Starting Clustering - Clustering Progress: 
-------------------   --------------------------   ---------
Molecules processed   Number of clusters created   FPGA size
-------------------   --------------------------   ---------
     6/168       3%                            1    12 x 10    
Failed route at end, repack cluster trying detailed routing at each stage.
    12/168       7%                            0    12 x 10    
    18/168      10%                            1    12 x 10    
    24/168      14%                            2    12 x 10    
    30/168      17%                            2    12 x 10    
    36/168      21%                            3    12 x 10    
Failed route at end, repack cluster trying detailed routing at each stage.
    42/168      25%                            2    12 x 10    
    48/168      28%                            3    12 x 10    
    54/168      32%                            4    12 x 10    
    60/168      35%                            4    12 x 10    
Failed route at end, repack cluster trying detailed routing at each stage.
    66/168      39%                            4    12 x 10    
    72/168      42%                            4    12 x 10    
    78/168      46%                            5    12 x 10    
Failed route at end, repack cluster trying detailed routing at each stage.
    84/168      50%                            5    12 x 10    
    90/168      53%                            6    12 x 10    
    96/168      57%                            6    12 x 10    
   102/168      60%                            7    12 x 10    
   108/168      64%                            7    12 x 10    
   114/168      67%                            9    12 x 10    
   120/168      71%                           15    12 x 10    
   126/168      75%                           21    12 x 10    
   132/168      78%                           27    12 x 10    
   138/168      82%                           33    12 x 10    
   144/168      85%                           39    12 x 10    
   150/168      89%                           45    12 x 10    
   156/168      92%                           51    12 x 10    
   162/168      96%                           57    12 x 10    
   168/168     100%                           63    12 x 10    
   174/168     103%                           69    12 x 10    
   180/168     107%                           75    12 x 10    
   186/168     110%                           81    12 x 10    
   192/168     114%                           87    12 x 10    
   198/168     117%                           93    12 x 10    
   204/168     121%                           99    12 x 10    

Logic Element (fle) detailed count:
  Total number of Logic Elements used : 55
  LEs used for logic and registers    : 0
  LEs used for logic only             : 55
  LEs used for registers only         : 0

Incr Slack updates 1 in 1.0443e-05 sec
Full Max Req/Worst Slack updates 1 in 8.343e-06 sec
Incr Max Req/Worst Slack updates 0 in 0 sec
Incr Criticality updates 0 in 0 sec
Full Criticality updates 1 in 1.973e-05 sec
FPGA sized to 12 x 10 (castor10x8_heterogeneous)
Device Utilization: 0.07 (target 1.00)
	Block Utilization: 0.04 Type: io
	Block Utilization: 0.19 Type: clb

Start the iterative improvement process
the iterative improvement process is done
Clustering Statistics: 
----------   --------   ------------------------------------   --------------------------
Block Type   # Blocks   Avg. # of input clocks and pins used   Avg. # of output pins used
----------   --------   ------------------------------------   --------------------------
     EMPTY          0                                      0                            0   
        io         98                               0.336735                     0.663265   
       clb          7                                27.5714                      8.42857   
       dsp          0                                      0                            0   
      bram          0                                      0                            0   
Absorbed logical nets 11 out of 135 nets, 124 nets not absorbed.

Netlist conversion complete.

# Packing took 0.14 seconds (max_rss 22.0 MiB, delta_rss +2.5 MiB)
# Load packing
Begin loading packed FPGA netlist file.
Netlist generated from file '/nfs_scratch/scratch/CompilerValidation/zaheer_ahmad/FullAdder32/FullAdder32/run_1/synth_1_1/impl_1_1_1/packing/fabric_FullAdder32_post_synth.net'.
Detected 0 constant generators (to see names run with higher pack verbosity)
Finished loading packed FPGA netlist file (took 0.05 seconds).
# Load packing took 0.06 seconds (max_rss 60.4 MiB, delta_rss +38.4 MiB)
Warning 265: Netlist contains 0 global net to non-global architecture pin connections

Pb types usage...
  io             : 98
   io_output     : 33
    outpad       : 33
   io_input      : 65
    inpad        : 65
  clb            : 7
   clb_lr        : 7
    fle          : 55
     fast6       : 31
      lut6       : 31
       lut       : 31
     ble5        : 39
      lut5       : 39
       lut       : 39

# Create Device
## Build Device Grid
FPGA sized to 12 x 10: 120 grid tiles (castor10x8_heterogeneous)

Resource usage...
	Netlist
		98	blocks of type: io
	Architecture
		576	blocks of type: io_top
		576	blocks of type: io_right
		576	blocks of type: io_bottom
		576	blocks of type: io_left
	Netlist
		7	blocks of type: clb
	Architecture
		36	blocks of type: clb
	Netlist
		0	blocks of type: dsp
	Architecture
		2	blocks of type: dsp
	Netlist
		0	blocks of type: bram
	Architecture
		2	blocks of type: bram

Device Utilization: 0.07 (target 1.00)
	Physical Tile io_top:
	Block Utilization: 0.17 Logical Block: io
	Physical Tile io_right:
	Block Utilization: 0.17 Logical Block: io
	Physical Tile io_bottom:
	Block Utilization: 0.17 Logical Block: io
	Physical Tile io_left:
	Block Utilization: 0.17 Logical Block: io
	Physical Tile clb:
	Block Utilization: 0.19 Logical Block: clb
	Physical Tile dsp:
	Block Utilization: 0.00 Logical Block: dsp
	Physical Tile bram:
	Block Utilization: 0.00 Logical Block: bram

## Build Device Grid took 0.00 seconds (max_rss 60.4 MiB, delta_rss +0.0 MiB)
Warning 266: Tileable routing resource graph does not support clock modeling yet! Related options are ignored...
## Build tileable routing resource graph
X-direction routing channel width is 160
Y-direction routing channel width is 160
Warning 267: Sized nonsensical R=0 transistor to minimum width
Warning 268: Sized nonsensical R=0 transistor to minimum width
Warning 269: Sized nonsensical R=0 transistor to minimum width
Warning 270: Sized nonsensical R=0 transistor to minimum width
## Build tileable routing resource graph took 0.53 seconds (max_rss 60.4 MiB, delta_rss +0.0 MiB)
  RR Graph Nodes: 113424
  RR Graph Edges: 231966
# Create Device took 0.54 seconds (max_rss 60.4 MiB, delta_rss +0.0 MiB)


Flow timing analysis took 0.00359706 seconds (0.00354692 STA, 5.0141e-05 slack) (1 full updates: 1 setup, 0 hold, 0 combined).
VPR succeeded
The entire flow of VPR took 0.96 seconds (max_rss 60.4 MiB)
